{
  "$schema": "https://json-schema.org/draft/2020-12/schema",
  "$id": "https://your-registry/schemas/extension/v1.json",
  "title": "Extension manifest v1",
  "type": "object",
  "additionalProperties": false,
  "required": ["$schema", "id", "version", "type", "title", "description", "compatibility", "license"],
  "properties": {
    "$schema": { "type": "string", "format": "uri" },
    "id": {
      "type": "string",
      "pattern": "^[a-z][a-z0-9-]*$",
      "description": "Stable slug; primary registry key; immutable once published."
    },
    "version": {
      "type": "string",
      "pattern": "^\\d+\\.\\d+\\.\\d+(?:-[0-9A-Za-z-.]+)?(?:\\+[0-9A-Za-z-.]+)?$",
      "description": "semver; MUST equal package.json version (CI-enforced)."
    },
    "type": {
      "type": "string",
      "enum": ["agent", "skill", "mcp-server", "prompt", "hook", "command"]
    },
    "title": { "type": "string", "minLength": 1 },
    "description": { "type": "string", "minLength": 1 },
    "compatibility": {
      "type": "object",
      "additionalProperties": false,
      "required": ["host"],
      "properties": {
        "host": {
          "type": "string",
          "description": "semver range of supported host versions, e.g. '>=1.0.0 <2.0.0'."
        }
      }
    },
    "entrypoint": {
      "type": "string",
      "description": "Resolved at install. Required for behavioral types; omitted for prompt (host convention: prompt.md)."
    },
    "author": { "type": "string" },
    "license": { "type": "string" },
    "requires": {
      "type": "object",
      "additionalProperties": false,
      "description": "Static capability requirements checked against configured provider at install time.",
      "properties": {
        "tool_calling": { "type": "boolean", "default": false },
        "structured_output": { "type": "boolean", "default": false },
        "min_context_tokens": { "type": "integer", "minimum": 1 }
      }
    },
    "order": {
      "type": "integer",
      "default": 100,
      "description": "Hook execution order for the bound lifecycle event (ascending). Only meaningful when type=='hook'. Ties broken by id lexicographic. See Gap 2."
    },
    "dependencies": {
      "type": "array",
      "items": {
        "type": "object",
        "additionalProperties": false,
        "required": ["id", "version"],
        "properties": {
          "id": { "type": "string", "pattern": "^[a-z][a-z0-9-]*$" },
          "version": { "type": "string" }
        }
      }
    },
    "capabilities": { "type": "array", "items": { "type": "string" } },
    "tags": { "type": "array", "items": { "type": "string" } },
    "repository": { "type": "string", "format": "uri" },
    "private": { "type": "boolean", "default": false },
    "checksum": {
      "type": "string",
      "pattern": "^sha256:[0-9a-f]{64}$",
      "description": "Populated by CI at publish time; verified on install."
    },
    "runtime": {
      "type": "string",
      "enum": ["node", "stdio-any"],
      "default": "node",
      "description": "Author-declared runtime contract. 'node' = TS/Node, can call the provider abstraction. 'stdio-any' = language-agnostic stdio process; MUST NOT declare provider requires. Absent => 'node' (back-compat: all v1 extensions are Node)."
    },
    "lifecycle": {
      "type": "object",
      "additionalProperties": false,
      "description": "Host-owned process supervision for long-running extensions. Optional; absent => v1 request/response behavior (no daemon). Only meaningful for type in {mcp-server, agent}.",
      "properties": {
        "background": {
          "type": "boolean",
          "default": false,
          "description": "If true the host keeps the process alive across calls (supervised) instead of lazy per-call spawn."
        },
        "singleton": {
          "type": "boolean",
          "default": true,
          "description": "At most one host-supervised instance per scope key. Host holds the lock — replaces the extension's own OS advisory lock."
        },
        "health": {
          "type": "object",
          "additionalProperties": false,
          "description": "How the host probes liveness. Absent => process-alive only.",
          "properties": {
            "type": {
              "enum": ["stdio-ping", "socket", "command"],
              "default": "stdio-ping"
            },
            "endpoint": {
              "type": "string",
              "description": "Socket path or command; required when type in {socket, command}."
            },
            "interval_ms": {
              "type": "integer",
              "minimum": 250,
              "default": 5000
            },
            "timeout_ms": {
              "type": "integer",
              "minimum": 100,
              "default": 2000
            }
          }
        },
        "stop_timeout_ms": {
          "type": "integer",
          "minimum": 0,
          "default": 5000,
          "description": "Grace period on SIGTERM before SIGKILL."
        }
      }
    }
  },
  "allOf": [
    {
      "if": { "properties": { "type": { "const": "hook" } } },
      "then": { "required": ["entrypoint"] }
    },
    {
      "if": { "properties": { "type": { "enum": ["agent", "skill", "mcp-server", "command"] } } },
      "then": { "required": ["entrypoint"] }
    },
    {
      "if": { "properties": { "runtime": { "const": "stdio-any" } } },
      "then": { "properties": { "requires": {
        "properties": { "structured_output": { "const": false },
                        "tool_calling":      { "const": false } } } } }
    },
    {
      "if":   { "required": ["lifecycle"] },
      "then": { "properties": { "type": { "enum": ["mcp-server", "agent"] } } }
    }
  ]
}
