{
  "$schema": "https://your-registry/schemas/extension/v1.json",
  "id": "memory-flush",
  "version": "0.1.0",
  "type": "hook",
  "title": "Memory Session Flush",
  "description": "On SessionEnd: persists working memory, enqueues episodes, nudges memoryd. Also binds ScopePromotionProposed to run the promotion approval/policy step.",
  "compatibility": { "host": ">=1.0.0 <2.0.0" },
  "entrypoint": "dist/index.js",
  "license": "MIT",
  "runtime": "node",
  "order": 100,
  "dependencies": [{ "id": "memory-server", "version": "^0.1.0" }],
  "tags": ["memory", "lifecycle"]
}
